"id","name","url","category","ingredients","steps"
"101837565","煎出来的包子更好吃【生煎包】","https://www.xiachufang.com/recipe/101837565/","煎","","将面粉，水，酵母一起放入搅拌桶中。 | 将搅拌桶放进厨师机中，装好和面棒。 | 按下厨师机头，揉面先从一档开始，待面粉成团后逐渐加速，搅至面团表面光滑即可。 | 取出搅好的面团，揉成光滑的圆形，放入盆中，盖上保鲜膜，放温暖处发酵。 | 趁面团发酵的时间，准备馅料，将猪肉馅，鸡蛋，姜末，葱末，及所有调料一起放入搅拌桶中。 | 将搅拌桶放进厨师机中，装好人字浆搅拌棒。 | 按下厨师机头，先从一档开始搅拌，刚开始馅料比较稀，慢慢就会发现搅拌好以后的馅料非常均匀，粘性很好。 | 当面团发至2倍-2.5倍大时面团发酵完成。 | 发好的面团取出，用手揉搓至面团紧实光滑，内部无气孔时搓成长条。 | 分成15克每个的面团，擀圆，中间放上馅料。 | 用包子的方法，包起来捏紧。 | 收口朝下在操作台上用手整形成圆球状，底部刷一点水，沾一层白芝麻，放在一旁边醒发20-30分钟。 | 平底锅烧热倒适量食用油，放入发好的包胚，中小火煎至底部呈金黄色。 | 加入清水，水量约为包胚一半的高度，盖好锅盖烧开后转中小火煎15分钟，汤汁收完后，不开锅盖焖3分钟，出锅前撒黑芝麻和香葱碎即可。"
"107556269","自制雪糕、💯零添加","https://www.xiachufang.com/recipe/107556269/","甜品",""," |  | 食材全部加入，搅拌均匀过筛一遍。 | 倒入不沾锅，中小火用刮刀不停搅拌，防止糊底，煮到变像酸奶状浓稠，就可以关火了把它晾凉～ | 晾凉后倒入模具，放入冰箱冷冻成型，然后就可以打包啦。"
"107186653","无油无糖！布鲁姆欧包~外脆内软超简单","https://www.xiachufang.com/recipe/107186653/","烤箱","","提前做波兰种，有两种做法，一是室温发酵至2-3倍大，二是冰箱过夜冷藏发酵，夏季用方法二更好，我的做法是晚上临睡前做波兰种冰箱冷藏→第二天吃完早饭就可以做面包了，很省事 | 1️⃣加波兰种和其他主面团材料后搅拌均匀手揉或者厨师机都可以，揉到表面光滑即可，无需揉出膜，室温醒发到2倍大（当前室温29，用时约一小时）2️⃣表面撒粉倒扣在台面上，轻拍排气，擀长一点，从上而下卷起，再擀长然后自上而下卷起，搓长呈椭圆形，烤箱发酵模式38°约40分钟，醒发到二倍大 |  | 3️⃣醒发后，表面撒粉割几刀，提前预热烤箱220°，烤盘上放盆水和面包同烤，放水的目的是制造蒸汽，入炉后箱内喷水20次迅速关烤箱门 | 4️⃣220°烘烤到15分钟，调整温度上下火200°再烤13-15分钟，若上色过快请在15分时加盖锡纸 |  | "
"107313707","鱼香肉丝","https://www.xiachufang.com/recipe/107313707/","鱼香","","肉丝腌一下：料酒，淀粉，盐，生抽，油 | 料汁：生抽2，老抽1，陈醋1，蚝油1，淀粉1，白糖1，半碗清水 | 木耳泡好撕一下 | 1⃣️肉丝炒一下 | 盛出备用 | 2⃣️葱蒜炒一下，豆瓣酱1炒一下 | 3⃣️倒入切好的菜 | 4⃣️木耳也倒进去，翻炒一下 | 5⃣️倒入肉丝 | 6⃣️单曲料汁 | 7⃣️翻炒均匀，调味出锅"
"104686170","夏日必备🥒爽口小黄瓜","https://www.xiachufang.com/recipe/104686170/","下饭菜","","小黄瓜，洗净，切开，用盐杀出水，大概杀两个小时，然后洗净，放入盆中 | 调汁部分，辣椒油，白糖，醋，酱油，鸡精根据黄瓜的多少和自己的口味适量添加，边添边尝。 | 重点来了，锅中放油，葱段，姜片，蒜片下锅炒出香味儿，微微焦黄，然后把葱姜蒜捡出来，油放凉。 | 油放温之后，淋在拌好的黄瓜上，搅拌均匀，放入冰箱，第二天可以开吃啦！"
"107424814","杏鲍菇牛肉粒","https://www.xiachufang.com/recipe/107424814/","下饭菜",""," |  |  |  |  | 食材准备🥩：腌牛里脊：牛里脊400g、盐1.5g、生抽10g、耗油10g、黑胡椒碎2g、细砂糖3g、小苏打粉2g、玉米淀粉3g、玉米油适量；酱汁：生抽20g、耗油10g、细砂糖5g、玉米淀粉5g、清水45g；配菜：蒜瓣50g、杏鲍菇块300g、黑胡椒碎5g、彩椒块100g、洋葱块30g；做法如下：[爱心][爱心]1、牛里脊切小方块，杏鲍菇切块，彩椒切小块、洋葱切丁；2、将切好的牛肉粒放入碗中，再倒入准备好的腌料下手抓匀，最后加入适量食用油抓匀，密封冷藏2小时左右备用；3、小碗力倒入生抽、耗油、细砂糖、玉米淀粉、清水搅匀成酱汁备用；4、热锅倒少许油，大火，将牛肉粒表面煎至金黄色盛出备用；5、不用洗锅，再倒入少许油，下入杏鲍菇粒和蒜瓣粒重中大火至表面金黄色，盛出备用；6、不用洗锅，再倒入少许油，下入黑胡椒碎，小火炒香，加入彩椒块和洋葱丁大火炒香；7、最后加入炒好的牛肉粒和杏鲍菇粒翻炒均匀，再倒入调好的料汁快速翻拌均匀即可出锅开吃"
"107525654","软糯又好吃的黄豆焖鸡爪","https://www.xiachufang.com/recipe/107525654/","焖","","新鲜鸡爪洗干净，切成两半，冷水下锅加入姜片、小葱、适量料酒，煮开焯水 | 焯水后捞出冲洗干净 | 将鸡爪放入高压锅，再加入提前泡发好的黄豆 | 再加适量的干辣椒、姜片、蒜瓣、八角、桂皮、香叶、一小块冰糖、老抽、料酒（口味咸淡可根据自己喜好调整） | 加入适量清水，盖上高压锅盖开火煮，上汽后煮5分钟关火（这步可根据自己的工具锅调整时间，煮软烂即可） | 用高压锅焖煮后的样子 | 准备好小米辣、干辣椒、蒜末 | 接下来用炒锅，热油后加入小米辣和蒜末翻炒均匀，再加入干辣椒末 | 把煮好的鸡爪黄豆捞出倒入锅中（汤汁留着）一起翻炒均匀，可根据自己的口味再加入一丢丢盐和味精、生抽、蚝油翻炒 | 再把汤汁倒入一起焖煮，开大火收汁 | 做好啦！出锅～撒点葱花～"
"103957016","简单易做红烧肉","https://www.xiachufang.com/recipe/103957016/","家常菜","","凉水下锅，加入五花肉，2段葱，3片姜，水烧开后，撇掉杂质 | 将五花肉，葱段，姜片一起捞出，控干水分，备用 | 热锅倒入少许食用油，加入7-8粒冰糖，大火熬制，冰糖融化后出现小泡时，加入之前控干的五花肉（葱段，姜片也一起加入），迅速翻炒，直至五花肉表面有轻微的焦黄色！注意：五花肉尽量控干水分，加入油锅中以免外溅！冰糖熬制过程中，出现小泡就立即加入五花肉，太晚加入，容易糊！ | 五花肉表面粘上糖液，颜色呈焦黄，加入1勺料酒，3勺生抽，1勺老抽（也可用红烧酱油）继续翻炒五花肉 | 裹上糖液，加入料酒，生抽，老抽后的五花肉，表面已经有颜色了，此时加入开水，水量末过五花肉表面 | 加入桂皮2块，香叶2-3片， | 水烧开后转小火，慢慢入味儿，根据个人口味，入味的过程中可以适量加入白糖，娃非常喜欢甜咸口，所以我一般都会加入一些 | 大约小火半小时后加入适量的盐，因为之前有生抽和老抽了，所以盐一定少加 | 等汤汁收的差不多，就可以盛盘享受美味了"
"107510422","家常/肉酱拌面","https://www.xiachufang.com/recipe/107510422/","面条","","锅烧热多加点食用油炒香肉沫，加调味品 | 炒成肉酱盛出备用 | 这个肉酱真的巨想！ | 准备好自己爱吃的面条，菜市场买的鲜面条也一样哦！ | 面条煮熟捞出 | 面条上来点肉酱 | 好漂亮啊！ | 拌面～流口水了🤤 | 越拌越香 | 蔬菜面更有食欲吧 | 开吃啦！"
"106179781","Joyclad｜隔三差五就想念的家常小炒藕丁","https://www.xiachufang.com/recipe/106179781/","菜谱","","小葱切段，小米辣切圆圈、蒜泥，不能吃辣的不放小米辣或者少放 | 藕切丁焯烫2分钟捞出控干水备用这个藕孔里有淤泥，洗了好久还是这个死样子，不是没洗干净的哈😝～ | 锅中倒入油，油热放葱、小米辣、蒜泥 | 火不要太大，炒1分钟 | 放入藕丁，放入老抽小半勺 | 生抽2勺 | 蚝油大半勺、在放入少许盐、白糖，转大火翻炒2分钟即可，这是一道什么都可以放下，唯独放不下筷子的美食～或是减肥路上的绊脚石想好在做！ | 🉑️太香了小🍠，某抖一直在更新美食，感兴趣的朋友可以观看👀详细教程！"
"107414496","自制饮品、奶茶～杨枝甘露","https://www.xiachufang.com/recipe/107414496/","饮品","","杨枝甘露芒果酸奶西柚西米 | 草莓甘露草莓酸奶西米 | 芋泥甘露芋头紫薯牛奶酸奶西米 | 火龙果甘露火龙果酸奶西米 | 蜜桃西米露蜜桃酸奶西米 | 牛油果甘露牛油果芒果西柚酸奶西米 | 蓝莓西米绿蓝莓酸奶西米 | 绿豆牛乳沙绿豆牛奶冰块 | 红豆牛乳沙红豆牛奶冰块 | 火龙果冻撞奶火龙果牛奶白凉粉西米 | 香橙冻撞奶香橙牛奶白凉粉西米 | 西瓜冻撞奶西瓜牛奶白凉粉西米 | 珍珠奶茶木薯淀粉红茶白糖牛奶"
"106479890","10分钟搞定的快手凉拌菜，清脆爽口的凉拌莴笋丝","https://www.xiachufang.com/recipe/106479890/","凉菜","","莴笋去皮切成丝，，小米辣切圈，蒜切末。锅中放入适量的清水，水烧开后放入莴笋丝，焯水1分钟捞出，放入凉水中浸泡一会儿。 | 锅中放入适量的油，油热后淋入小米辣和蒜末中碗中➕生抽2勺➕香醋2勺➕白糖1勺➕芝麻油1勺➕盐适量搅拌均匀。 | 浸泡好的莴笋沥干水份，放入盘中，淋上刚调好的酱汁即可开吃。"
"106130678","酸辣娃娃菜","https://www.xiachufang.com/recipe/106130678/","家常菜","","先调好酱汁，大蒜拍扁，干辣椒切段，热锅放油爆香干辣椒和大蒜，加入娃娃菜大火炒软，然后倒入酱汁翻炒均匀即可； | 一个菜能干两碗白米饭～ | 酸酸辣辣的，炒的时候一定要大火才有那种烟火味儿～"
"102351079","南瓜包子馒头（零失败，新手必备）","https://www.xiachufang.com/recipe/102351079/","包子","","南瓜切片用蒸笼蒸熟（称175克）捣成泥趁“热”加糖拌几下，什么糖都行一下子就化了，放凉备用 | 50克的温水加5克酵母粉 用一根筷子轻轻化开，备用 | 把450克面粉倒入南瓜泥里，用筷子拌几下，再加入已化开的酵母水，揉面开始喽……揉到：盆光，手光，粉光 。再加猪油继续揉……// 有厨师机的小伙伴们猪油或玉米油一起放 | 这是揉好的面团，光滑不粘手的 | 有时间的可以装盆子盖保鲜膜进行发酵，发到2倍大就可以拿出来揉面排气，切面无气孔最好。// 没时间的小伙伴可以直接分割成小剂子，整成想要的形状进行一发…… | 有几个是为方便捏成碗形，我撒了些许手粉。因为我不太会用擀面杖只能用手慢慢捏喽😄 每个小面团50克 可以分10多个呢 | 全部摆上蒸笼，让它们自然地发酵，明显变大了 手轻轻一按包子面，凹下去又马上还原了 就可以蒸了 开水下锅 等会儿看到冒蒸气 就大火蒸6分钟关火 闷5分钟再开盖 | 馒头组织非常完美 | 有包馅料的也美美 | 松软可口 | 这是馒头 | 恶搞😄😄没有皮的包包 | 以下是后续补充：一发的馒头，蒸烤箱30度发酵40分钟，100度蒸15分钟 | 一发的毛毛虫🐛蒸烤箱30度发酵40分钟，100度蒸15分钟 | 一发的豆沙包，蒸烤箱30度发酵40分钟，100度蒸15分钟 | 一发面团呛粉揉光滑 | 每个面团都要手揉到光滑，成品才不让你失望！蒸烤箱30度发酵40分钟，100度蒸15分钟 | "
"106535596","吃了想开店的苏式鲜肉月饼，月饼店老板们急哭了","https://www.xiachufang.com/recipe/106535596/","月饼","","刚出炉的鲜肉月饼 | 准备好馅料部分材料，新鲜洋葱，香菇，猪绞肉，猪油，熟芝麻 | 调料部分可以按着我的放，或者自己再调一下味道 | 洋葱丁小火炸成油葱酥，捞出来备用 | 香菇丁热油炸2分钟左右，捞出备用 | 炸好的油葱酥和香菇 | 馅料部分的所有材料倒入容器里 | 搅拌成团，冷藏放冰箱备用 | 准备月饼皮的部分，月饼皮的高筋粉和中筋粉可以直接用全部的中筋粉代替 | 所有材料倒入厨师机内，先慢速搅拌至没用干粉，再开快速。也可以手揉，揉到能拉出厚厚的膜就行了 | 搅拌出厚厚的手套膜 | 准备好油酥需要的材料 | 倒入厨师机，慢速搅拌这一部同样可以手揉，搓到没猪油块的状态 | 最终用手捏到能成团就可以 | 月饼皮分割成25克一团油酥20克一团揉圆 | 皮的部分压薄 | 包入油酥 | 底部收紧 | 包好的样子 | 包好后盖上保鲜膜松弛30分钟 | 30分钟后，取出一团，稍微整形成圆柱形 | 用擀面杖擀成牛舌状 | 反过来从上往下卷 | 卷起来 | 卷好之后，盖上保鲜膜松弛30分钟 | 松弛好以后，取出一团，用手稍微按扁 | 再次擀成牛舌状，不要用太大力，防止擀破漏出油酥 | 再次反过来，底部稍微打薄，从上往下卷 | 卷好之后再盖上保鲜膜松弛30分钟 | ， | 松弛好以后，取出一团，用食指在面团中间按压 | 用两个大拇指，从两头往中间按平 | ， | 翻过来用擀面杖擀开 | 取30克馅料，包入月饼皮内 | 包好的月饼 | 烤盘上垫油纸，月饼放到烤盘上，注意间距 | 食用色素加水稀释，给月饼盖上章 | 如果表面太干，可以喷点水再盖章 | ， | 烤箱提前预热，上火180度，下火170度，放在烤箱下层先烤30分钟 | 30分钟以后调转方向再烤5分钟，香喷喷的鲜肉月饼就出炉啦！ | 香，鲜，酥到掉渣，一个根本不够"
"107098663","儿童成长汤之羊肚菌玉竹汤","https://www.xiachufang.com/recipe/107098663/","早餐","","准备食材 | 把食材用水泡个15分钟清洗干净 | 瘦肉切小块冷水下锅 | 煮开后清洗干净 | 红枣祛核 | 所有食材放入炖盅加入一饭碗半的清水(350ml左右） | 炖两个小时左右 | 好后加入适量的盐调味 | 我是用燕窝盅炖的一个人的份量"
"104579408","简单好吃的啤酒鸭","https://www.xiachufang.com/recipe/104579408/","菜谱","","将鸭肉切块洗净，冷水下锅，加入两片姜片，适量料酒，花椒少许，香叶一片，桂皮两小块，八角两个，焯水，可以多焯一会后面就不用煮太久，十五分钟左右捞出控水（取出里面的料） | 锅中热油，下入鸭肉和花椒，翻炒至微微焦黄 | 鸭肉扒到一边，加入姜蒜翻炒，炒出姜蒜香味 | 再加入一勺豆瓣酱，翻炒，炒出红油 | 再加入香叶，八角，桂皮，干辣椒翻炒均匀 | 加入生抽老抽白糖，再加入一瓶啤酒（我用的是玻璃瓶装的一瓶刚好没过鸭肉，所以没有加水，啤酒不够的可以加温水） 翻匀一下盖上锅盖中小火煮二十分钟左右（根据鸭肉软烂程度）中途开盖翻一下 | 开盖后，加入适量盐调味（可以先尝尝咸淡，因为豆瓣酱有咸味）大火收汁，加入青红椒炒至断生，关火🔥出锅 | 一道简单又好吃的啤酒鸭就做好啦"
"106458603","平底锅就能做，香甜软糯的南瓜饼，一次成功","https://www.xiachufang.com/recipe/106458603/","早餐","","南瓜去籽去皮切片 | 水开上锅蒸熟 | 加入白糖 | 压成泥 | 加入糯米粉 | 搅拌成絮状 | 揉成光滑面团 | 分成大小的剂子， | 压扁 | 平底锅刷油，放入南瓜饼，煎至两面金黄即可！ | 真的太好吃了，糯叽叽！"
"106591062","好吃到停不下来的油焖大虾❗️简单快手零失败～","https://www.xiachufang.com/recipe/106591062/","家常菜","","😊虾肉紧实弹牙！好吃到汤汁都不放过，喜欢的不要错过哦～ | 🔆大虾用新鲜的虾来做更好吃哦！虾洗净剪去虾须去虾线 | 1勺料酒、2勺生抽、1勺蚝油、1勺醋、1勺糖、1勺番茄酱、3勺水搅匀备用 | 锅加热倒油炒香葱花蒜末，放入虾炒至变色，加入碗汁翻炒均匀，焖煮2分钟，大火收汁，出锅撒葱花即可 | 好好吃 | 👉今天的基围虾是在大润发采购的，菜品新鲜又实惠！👏👏全家人爱吃的水果蔬菜这里都有，还有日用百货和粮油，一站式购物！真的很奈斯~ | 💕现在大润发双十一活动，超5000支商品五折直接享，价格便宜不说品质也特别好～像我今天买的的虾、洗洁精、餐巾纸等折扣力度超大，真的省下不少钱～而且去线下选购更直接，喜欢什么就挑什么，挑到你满意～省钱小能手就是我，嘻嘻～💕 对了，他家还有线上app，足不出户在家动动手指就能买买买，具体商品价格以卖场实际折扣为准"
"106510847","下饭菜「脆爽黄瓜片」","https://www.xiachufang.com/recipe/106510847/","家常菜","","黄瓜洗净 | 切片 | 撒盐 腌制1.5-2小时 出出水分 | 洗几遍再用屉布压出水分 | 装入容器 | 准备盐➕鸡精➕干辣椒段➕辣椒面➕蒜末➕葱丝➕芝麻 | 油热 浇在上面 | 搅拌 | 陈醋➕生抽➕蚝油➕白糖➕个人加点麻油 | 料汁凉凉再倒入黄瓜上 | 全部倒入黄瓜上 | 手抓均匀 | 放入冰箱冷藏2小时以上入入味儿 | 爽口小咸菜 也可以是小凉菜 | 很爽口的  动手试试吧"
"106771475","最简单下饭神器🫑擂椒皮蛋","https://www.xiachufang.com/recipe/106771475/","快手菜","","青椒洗净，空气炸锅180度15分钟，中途翻面烤软 | 青椒撕成条，加入皮蛋，捣一捣 | 加入酱汁：生抽➕香醋➕香油➕蒜末 | 加入小米椒搅拌搅拌，太好吃啦！下饭神器，一顿能吃两碗饭"
"107027928","完美复刻❗️哈根达斯冰淇淋配方❗️揭秘（巧克力味）","https://www.xiachufang.com/recipe/107027928/","甜品","","淡奶油和牛奶一起，加入锅里小火加热至不烫手，温度大概不超60度 | 6个蛋黄加入150克的糖里拌匀 | 把步骤1的奶液加入到步骤2的蛋黄液里，边加边搅拌均匀 | 把步骤3的混合液重新倒入锅里小火加热到80度后离火，边加热边搅拌（此步是为了给蛋黄消毒杀菌） | 离火后衬热加入黑巧克力和可可粉搅拌融化。 | 把巧克力液体过筛放凉后放冰箱冷藏备用，为了节省时间我直接放冰箱冷冻室内冷冻1小时，目的是缩短冷藏时间，让巧克力液体更容易打发，如果冷藏时间不足会影响下一步打发。 | 把冷藏好的巧克力液从冰箱取出，打蛋器高速打发至能看到纹路，且颜色变浅，体积明显膨胀就可以了，打发好后放入冷冻室，冷冻1小时后备用。（如果此步骤你打发不起来，有可能是因为你冷藏的时间不够哦，可以延长冷藏时间再打发）。 | 把冷冻了一小时的巧克力液重新取出，继续打发，把开始结冰的小冰渣都打散。（此步目的是为了让做出来的冰淇淋口感更顺滑吃起来没有冰渣）。 | 重复一次上面步骤8，冷冻一小时后再打发一次。这次打发好后就可以直接分装到冰淇淋的盒子里，放入冷冻室大约4到5小时，或者直接冷冻过夜，冷冻好后就可以食用了。 | 成品出来，非常丝滑美味哦，值得无限次做。 | 加点奥利奥饼干碎，更好吃"
"107559035","超可爱！好吃又简单的迷你岩烧乳酪面包~","https://www.xiachufang.com/recipe/107559035/","面包","","首先准备好所需食材厨师机倒入面团材料（除了黄油和盐以外） | 慢速搅拌成团后转中高速揉面 | 揉至可以拉出厚膜 | 加入软化的黄油和盐慢速搅拌吸收，转中高速揉面 | 揉至可以拉出薄膜，将面团送入发酵箱28度发酵1个小时左右 | 发酵至2倍大小，手指沾面粉插入面团不回缩即可 | 将面团直接分割成24个揉圆放入模具中，送入烤箱36度发酵 | 制作岩烧乳酪酱，所有材料隔热水融化后装入裱花袋放凉备用 | 面团发酵至2倍大小 | 表面筛一层高筋面粉，用刀切出十字 | 挤上岩烧乳酪酱 | 送入提前预热好的烤箱，风炉模式160度烘烤15分钟左右 | 每个人的烤箱不同，烘烤时间温度仅作为参考！ | 出炉后轻震烤盘，放凉即可食用！ | 完成！"
"106087391","5分钟搞定爆好吃耗油生菜，减肥餐必备菜谱","https://www.xiachufang.com/recipe/106087391/","减肥","","生菜洗净备用，锅内清水煮开加入少许盐放入生菜煮开，捞起控干水份装盘 | 少许油加热爆香蒜末，加入两勺蚝油，一勺生抽，少许盐，一点点清水小火煮开，淋在生菜上即可 | 好吃又简单，不想吃肉的时候给自己来一盘蚝油生菜吧！ | 色香味俱全"
"107121488","能干掉几碗饭的酸辣藕带炒肉丝","https://www.xiachufang.com/recipe/107121488/","家常菜","","看着就下饭🥰 | 👩🏻‍🍳料汁：加2勺生抽➕1勺香醋➕半勺蚝油➕少许盐 糖 鸡精➕半勺红薯🍠淀粉➕小半碗清水搅匀。制作过程看上图哈⬆️⬆️ | 肉丝鲜香 | 藕带清脆"
"107181427","🏆青椒肉丝⭐️五星级做法","https://www.xiachufang.com/recipe/107181427/","家常菜","","先把肉丝腌制：按顺序：一勺生抽，1/3勺胡椒粉，1/3勺盐，一勺淀粉，半勺食用油，拌匀备用 | 青椒洗净去筋，切丝拍蒜末半碗水加入一勺淀粉，搅拌均匀 | 油微热，爆香蒜末倒入肉丝，快速翻炒肉丝炒熟，放入青椒，翻炒断生放入调料，翻炒均匀淋入淀粉水，颠几下炒锅，出锅开吃"
"106541070","舒芙蕾 一一 第一次就成功！做法超级简单的一款甜品🍰","https://www.xiachufang.com/recipe/106541070/","蛋糕","","鸡蛋蛋清分离 把蛋清放进冷藏备用 | 蛋黄➕牛奶 用打蛋器搅拌均匀 | 加入面粉 Z字形搅拌成如图这样~ | 把蛋清取出 挤几滴柠檬进去去腥  分两次把细砂糖放入 打成提起是尖角状 | 把蛋白三分之一放进去面糊里翻拌翻拌均匀后 把面糊直接倒入剩下的蛋白里翻拌如图就可以啦 | 不粘锅平底锅 开火预热 热了小火！一定是小火！用大勺子挖一勺放进平底锅 在挖一勺放上面盖盖儿 5分钟~ | 这是5分钟后的样子 用铲子翻一下面再盖上盖儿 等1-2分钟 然后关火闷30秒 | 噔噔噔噔噔！成品来啦！哎呀松松软软~嫩嫩的 我家宝宝（2岁）自己吃了1个呢 宝宝很喜欢 你也试试吧~"
"106389253","好吃到连汤汁都不剩的白菜焖豆泡，给肉都不换","https://www.xiachufang.com/recipe/106389253/","家常菜","","准备食材 | 豆泡对半切开 | 白菜切块 | 起锅热油放入白菜炒软 | 加入半碗水 | 放入豆泡 | 加入一勺生抽 | 一勺蚝油 | 少许盐 | 一勺鸡汁 | 翻炒均匀，焖五分钟即可！ | 鲜甜好吃还美味！"
"107066800","辣子鸡丁～","https://www.xiachufang.com/recipe/107066800/","菜谱","","鸡胸肉切丁，加姜、1勺料酒、1勺生抽、1勺老抽、1勺蚝油、少许盐和胡椒粉、1勺淀粉，抓匀腌制半小时。 | 热油下鸡肉丁，炸至金黄后捞出，大概7-8分钟可盖上锅盖防止油溅到自己。 | 油温升高后，再复炸一遍，颜色更深后捞出。 | 锅里留底油，下蒜末、花椒、干辣椒炒香，倒入炸好的鸡丁翻炒均匀，加入2勺白芝麻、一点葱花，炒香即可。 | ～ | ～ | 装盘再撒上适量葱花～"
"106382997","低脂低卡一口一个西葫芦鸡蛋素蒸包","https://www.xiachufang.com/recipe/106382997/","小吃零食","","西葫芦刨丝加少许盐杀出水分 | 胡萝卜刨丝 | 鸡蛋炒熟 | 加入一勺生抽 | 一勺蚝油 | 一勺鲜鸡汁 | 适量十三香 | 搅拌均匀 | 饺子皮擀大一点 | 包入馅料 | 收口捏起来 | 上锅蒸十五分钟 | 出锅 | 皮薄馅大 | 请你吃 | 巨满足 | 好吃到停不下来"
"107546576","肉末花卷","https://www.xiachufang.com/recipe/107546576/","早餐","","酵母放入温水中化开，倒入面粉中搅拌均匀，揉成不粘手的的面团后盖上保鲜膜。放在一旁发酵备用。 | 调肉馅味道。 | 面发酵好之后，开始擀面皮，擀薄一些更好吃。铺上肉馅，卷起来，压扁，切开，卷花边，放锅里继续醒发10分钟，再开火蒸12分钟就完成了✅。 | 很多人不会卷花卷，单独分享一下。 | 我比较喜欢这种，好看🤩！"
"107537419","椰香四溢！适合分享的一款椰皇挞！","https://www.xiachufang.com/recipe/107537419/","菜谱","","首先准备好所需食材先制作挞壳，盆中倒入冷藏黄油+糖粉+盐+低筋面粉戴手套抓匀，搓成沙粒状 | 放入蛋黄揉匀 | 包入油纸中，擀开比模具直径大3cm | 将挞皮盖在模具中 | 插上适量的小孔 | 铺上油纸，放入派石 | 送入预热好的烤箱中，上下190度烘烤18分钟 | 制作椰皇馅，黄油软化加入细砂糖搅拌均匀 | 倒入全蛋液和牛奶搅拌均匀 | 倒入椰蓉搅拌均匀 | 倒入挞壳中 | 送入预热好的烤箱，上220下200度烤20分钟 | 出来后放凉即可食用！ | 完成！"
